<RequestWs3 requeteTempsAPied="false" xmlns="http://iaws/ws/contractfirst/station"
            xmlns:xsi="http://www.w3.org/2001/XMLSchema-instance"
            xsi:schemaLocation="http://iaws/ws/contractfirst/station RequestContract.xsd" >
    <adresse att="depart">
        <numeroRue>31</numeroRue>
        <nomRue>rue Valade</nomRue>
        <codePostal>31000</codePostal>
        <ville>Toulouse</ville>
    </adresse>
    <adresse att="arrivee">
        <numeroRue>38</numeroRue>
        <nomRue>rue Valade</nomRue>
        <codePostal>31000</codePostal>
        <ville>Toulouse</ville>
    </adresse>
</RequestWs3>